{
  "source_file": "/Users/machine/Documents/AQ/db/source/db-1/queries/queries.md",
  "extraction_timestamp": "20260218-0214",
  "total_queries": 30,
  "queries": [
    {
      "number": 1,
      "title": "moderate / aggregation",
      "question": "How has aircraft altitude varied over the past year? I'd like to see rolling averages and outlier counts broken down by day and aircraft.",
      "description": "Fleet operators monitor ADS-B telemetry to track how aircraft altitude varies over time, helping them spot anomalies and identify maintenance needs before they become critical. Each aircraft transmits a unique ICAO 24-bit transponder hex code, and altitude is recorded in feet. Operators need daily summaries to detect unusual patterns that might indicate sensor drift, flight envelope excursions, or operational issues. Produce daily aggregated altitude statistics for each aircraft, including rolli",
      "evidence": "Fleet operators monitor ADS-B telemetry to track how aircraft altitude varies over time, helping them spot anomalies and identify maintenance needs before they become critical. Each aircraft transmits a unique ICAO 24-bit transponder hex code, and altitude is recorded in feet. Operators need daily summaries to detect unusual patterns that might indicate sensor drift, flight envelope excursions, or operational issues. Produce daily aggregated altitude statistics for each aircraft, including rolling averages to smooth short-term fluctuations and outlier counts to flag abnormal readings. The query constructs four common table expressions (CTEs). First, it retains the 60 most recent telemetry points per aircraft to limit memory usage. Second, it computes a 5-row rolling average of altitude for each aircraft to identify trends. Third, it flags statistical outliers by calculating z-scores and marking any reading that exceeds 2 standard deviations from the mean; when ",
      "complexity": "moderate",
      "expected_output": "Aggregated metrics grouped by day and hex",
      "sql": "WITH cte_level_1 AS (\n    SELECT \n        *,\n        ROW_NUMBER() OVER (PARTITION BY hex ORDER BY timestamp DESC) AS rn,\n        DATE_TRUNC('day', timestamp) AS day_bucket,\n        DATE_TRUNC('week', timestamp) AS week_bucket,\n        EXTRACT(HOUR FROM timestamp) AS hour_val,\n        EXTRACT(DOW FROM timestamp) AS dow_val\n    FROM aircraft_position_history\n    WHERE timestamp >= CURRENT_TIMESTAMP - INTERVAL '365 days'\n),\ncte_level_2 AS (\n    SELECT\n        c1.*,\n        COUNT(*) OVER (PARTITION BY c1.day_bucket, c1.hex) AS daily_partition_count,\n        AVG(c1.altitude) OVER (PARTITION BY c1.hex ORDER BY c1.timestamp ROWS BETWEEN 4 PRECEDING AND CURRENT ROW) AS rolling_avg,\n        SUM(c1.altitude) OVER (PARTITION BY c1.hex ORDER BY c1.timestamp ROWS BETWEEN UNBOUNDED PRECEDING AND CURRENT ROW) AS cumulative_sum,\n        FIRST_VALUE(c1.altitude) OVER (PARTITION BY c1.hex ORDER BY c1.timestamp) AS first_val,\n        LAST_VALUE(c1.altitude) OVER (PARTITION BY c1.hex ORDER BY c1.timestamp ROWS BETWEEN UNBOUNDED PRECEDING AND UNBOUNDED FOLLOWING) AS last_val\n    FROM cte_level_1 c1\n    WHERE c1.rn <= 60\n),\ncte_level_3 AS (\n    SELECT\n        c2.*,\n        LAG(c2.altitude, 1) OVER (PARTITION BY c2.hex ORDER BY c2.timestamp) AS prev_value,\n        LEAD(c2.altitude, 1) OVER (PARTITION BY c2.hex ORDER BY c2.timestamp) AS next_value,\n        c2.altitude - LAG(c2.altitude, 1) OVER (PARTITION BY c2.hex ORDER BY c2.timestamp) AS delta_value,\n        AVG(c2.altitude) OVER (PARTITION BY c2.hex) AS partition_avg,\n        STDDEV(c2.altitude) OVER (PARTITION BY c2.hex) AS partition_stddev,\n        NTILE(5) OVER (PARTITION BY c2.hex ORDER BY c2.altitude) AS ntile_bucket,\n        RANK() OVER (PARTITION BY c2.day_bucket ORDER BY c2.altitude DESC) AS daily_rank\n    FROM cte_level_2 c2\n),\ncte_level_4 AS (\n    SELECT\n        c3.*,\n        CASE \n            WHEN c3.partition_stddev > 0 THEN (c3.altitude - c3.partition_avg) / c3.partition_stddev\n            ELSE 0 \n        END AS z_score,\n        DENSE_RANK() OVER (ORDER BY c3.cumulative_sum DESC) AS overall_rank,\n        PERCENT_RANK() OVER (PARTITION BY c3.hex ORDER BY c3.altitude) AS pct_rank,\n        CASE\n            WHEN c3.delta_value > 0 THEN 'Increasing'\n            WHEN c3.delta_value < 0 THEN 'Decreasing'\n            ELSE 'Stable'\n        END AS trend_direction\n    FROM cte_level_3 c3\n)\nSELECT\n    DATE_TRUNC('day', c4.timestamp) AS period,\n    c4.hex,\n    COUNT(*) AS record_count,\n    AVG(c4.altitude) AS avg_value,\n    PERCENTILE_CONT(0.25) WITHIN GROUP (ORDER BY c4.altitude) AS q1_value,\n    PERCENTILE_CONT(0.5) WITHIN GROUP (ORDER BY c4.altitude) AS median_value,\n    PERCENTILE_CONT(0.75) WITHIN GROUP (ORDER BY c4.altitude) AS q3_value,\n    STDDEV(c4.altitude) AS stddev_value,\n    MIN(c4.altitude) AS min_value,\n    MAX(c4.altitude) AS max_value,\n    SUM(CASE WHEN c4.z_score > 2 THEN 1 ELSE 0 END) AS outlier_count,\n    SUM(CASE WHEN c4.trend_direction = 'Increasing' THEN 1 ELSE 0 END) AS increasing_count,\n    AVG(c4.rolling_avg) AS avg_rolling,\n    MAX(c4.cumulative_sum) AS max_cumulative\nFROM cte_level_4 c4\nGROUP BY DATE_TRUNC('day', c4.timestamp), c4.hex\nHAVING COUNT(*) >= 2\nORDER BY period DESC, avg_value DESC\nLIMIT 100",
      "line_number": 204,
      "normal_query": "Calculate daily altitude statistics for each aircraft over the last 365 days, including rolling averages and outlier counts."
    },
    {
      "number": 2,
      "title": "moderate / aggregation",
      "question": "Can you show me weekly altitude statistics grouped by speed range? I need quartiles, outlier counts, and how many readings show an upward trend.",
      "description": "Flight analysts want to understand how altitude behavior differs across groundspeed ranges (measured in knots) to identify whether fast-flying aircraft exhibit different operational patterns than slower ones. For example, cruise-speed flight may show tighter altitude clustering, while climb or descent phases at different speeds may show more variability. This comparison helps optimize flight profiles and detect speed-related anomalies. Produce weekly altitude statistics segmented by speed bucket",
      "evidence": "Flight analysts want to understand how altitude behavior differs across groundspeed ranges (measured in knots) to identify whether fast-flying aircraft exhibit different operational patterns than slower ones. For example, cruise-speed flight may show tighter altitude clustering, while climb or descent phases at different speeds may show more variability. This comparison helps optimize flight profiles and detect speed-related anomalies. Produce weekly altitude statistics segmented by speed bucket, including quartiles to show distribution, counts of statistical outliers, and counts of readings that are trending upward. The query groups telemetry by week and speed bucket. Within each speed bucket, it divides altitude readings into sextiles (six equal-frequency bins) to capture distribution shape. It calculates z-scores for each reading and flags those exceeding 2 standard deviations as outliers. Using the LAG and LEAD window functions, it compares each altitude re",
      "complexity": "moderate",
      "expected_output": "Aggregated metrics grouped by week and speed",